<?xml version="1.0" encoding="UTF-8"?>
<xs:schema xmlns:xs="http://www.w3.org/2001/XMLSchema">
    <xs:element name="estudiante">
        <xs:complexType>
            <xs:sequence>
                <xs:element name="nombre" type="xs:string"></xs:element>
                <xs:element name="apellidos" type="xs:string"></xs:element>
                <xs:element name="id" type="xs:int"></xs:element>
                <xs:element name="plan">
                    <xs:complexType>
                        <xs:sequence>
                            <xs:element name="cursos">
                                <xs:complexType>
                                    <xs:sequence>
                                        <xs:element name="curso" maxOccurs="unbounded" minOccurs="0">
                                            <xs:complexType>
                                                <xs:sequence>
                                                    <xs:element name="nombre" type="xs:string"></xs:element>
                                                    <xs:element name="nombre_corto" type="xs:string"></xs:element>
                                                    <xs:element name="registro" minOccurs="0">
                                                        <xs:complexType>
                                                            <xs:sequence>
                                                                <xs:element name="grado" type="xs:int"></xs:element>
                                                                <xs:element name="fecha" type="xs:string"></xs:element>
                                                            </xs:sequence>
                                                        </xs:complexType>
                                                    </xs:element>
                                                </xs:sequence>
                                            </xs:complexType>
                                        </xs:element>
                                    </xs:sequence>
                                    <xs:attribute name="anyo" type="xs:int"></xs:attribute>
                                </xs:complexType>
                            </xs:element>
                        </xs:sequence>
                    </xs:complexType>
                </xs:element>
            </xs:sequence>
        </xs:complexType>
    </xs:element>
</xs:schema>